{
 "alternatives_considered": [
  "carry w",
  "pass p_047"
 ],
 "attempt": 1,
 "claims": [
  {
   "evidence_ids": [
    "pc_005864"
   ],
   "kind": "tactical",
   "reject_reason": null,
   "text": "2v1 overload on the right in the middle third",
   "unit": null,
   "value": "overload_right_middle_third",
   "verified": false
  },
  {
   "evidence_ids": [
    "e_0362",
    "cf_000010"
   ],
   "kind": "player",
   "reject_reason": null,
   "text": "Bastian Sandoval",
   "unit": null,
   "value": "p_046",
   "verified": false
  },
  {
   "evidence_ids": [
    "e_0361"
   ],
   "kind": "player",
   "reject_reason": null,
   "text": "Jasper Cavendale",
   "unit": null,
   "value": "p_012",
   "verified": false
  },
  {
   "evidence_ids": [
    "cf_000010"
   ],
   "kind": "number",
   "reject_reason": null,
   "text": "1%",
   "unit": "p_goal",
   "value": 0.0122,
   "verified": false
  },
  {
   "evidence_ids": [
    "e_0362",
    "cf_000010"
   ],
   "kind": "team",
   "reject_reason": null,
   "text": "Ironvale Forge",
   "unit": null,
   "value": "ironvale",
   "verified": false
  },
  {
   "evidence_ids": [
    "cf_000010"
   ],
   "kind": "number",
   "reject_reason": null,
   "text": "8%",
   "unit": "p_goal",
   "value": 0.0784,
   "verified": false
  }
 ],
 "confidence": 0.95,
 "counterfactual_id": "cf_000010",
 "explanation_id": "ex_000013",
 "match_id": "m_4242",
 "model": "gemini-4-argon",
 "moment_id": "mo_00013",
 "prompt_version": "tactician@3",
 "schema_version": "1.0.0",
 "tool_trace_id": "16c334f056d99f17",
 "why": "Ironvale have a 2v1 overload on the right in the middle third, yet Sandoval shoots off target under Cavendale's pressure: a 1% goal chance. Carrying into the space instead lifts Ironvale Forge to 8%."
}
